{
  "case": "twin-lease-stop-holder",
  "covers": "ok",
  "hop": {
    "from": "panel",
    "to": "server"
  },
  "frames": [
    {
      "t_ms": 0,
      "frame": "{\"v\":1,\"type\":\"stop\",\"request_id\":\"e5HsW0uJ3Fg8NaCyOzXb1Q\"}"
    }
  ],
  "context": {
    "sender_holds_lease": true
  },
  "expect": {
    "reason": null
  }
}
