{
  "case": "drive-zero-panel-server",
  "covers": "ok",
  "hop": {
    "from": "panel",
    "to": "server"
  },
  "frames": [
    {
      "t_ms": 0,
      "frame": "{\"v\":1,\"type\":\"drive\",\"session_id\":\"kQ3v9XbT2mWc7ZyH4nPdLe\",\"seq\":0,\"freshness_token\":\"4200.kF7FLu2kWOb_gvVlpETLkCxjMa91_w7RYdLoyLNS5Rw\",\"left\":0,\"right\":0}"
    }
  ],
  "expect": {
    "reason": null
  }
}
