{
  "case": "stop-server-device",
  "covers": "ok",
  "hop": {
    "from": "server",
    "to": "device"
  },
  "frames": [
    {
      "t_ms": 0,
      "frame": "{\"v\":1,\"type\":\"stop\",\"request_id\":\"e5HsW0uJ3Fg8NaCyOzXb1Q\",\"lease_id\":\"r8JfA0sUo5GxN1tVqBhY6w\"}"
    }
  ],
  "expect": {
    "reason": null
  }
}
