{
  "case": "lease-granted-server-panel",
  "covers": "ok",
  "hop": {
    "from": "server",
    "to": "panel"
  },
  "frames": [
    {
      "t_ms": 0,
      "frame": "{\"v\":1,\"type\":\"lease\",\"state\":\"granted\",\"lease_id\":\"r8JfA0sUo5GxN1tVqBhY6w\"}"
    }
  ],
  "expect": {
    "reason": null
  }
}
