{
  "case": "twin-lease-arm-holder",
  "covers": "ok",
  "hop": {
    "from": "panel",
    "to": "server"
  },
  "frames": [
    {
      "t_ms": 0,
      "frame": "{\"v\":1,\"type\":\"arm\",\"request_id\":\"Zp2L9cMEd4TqYk7RxB1VnA\"}"
    }
  ],
  "context": {
    "sender_holds_lease": true
  },
  "expect": {
    "reason": null
  }
}
