{
  "case": "twin-size-drive-at-limit",
  "covers": "ok",
  "hop": {
    "from": "panel",
    "to": "server"
  },
  "frames": [
    {
      "t_ms": 0,
      "frame": "{\"v\":1,\"type\":\"drive\",\"session_id\":\"kQ3v9XbT2mWc7ZyH4nPdLe\",\"seq\":123,\"freshness_token\":\"4250.t7nkPssPxLNf4a4O89y7DQhNqVnaAenJIhSZtVN2L-8\",\"left\":0.7,\"right\":-0.7}",
      "pad": "limit"
    }
  ],
  "expect": {
    "reason": null
  }
}
