{
  "case": "arm-server-device",
  "covers": "ok",
  "hop": {
    "from": "server",
    "to": "device"
  },
  "frames": [
    {
      "t_ms": 0,
      "frame": "{\"v\":1,\"type\":\"arm\",\"request_id\":\"Zp2L9cMEd4TqYk7RxB1VnA\",\"lease_id\":\"r8JfA0sUo5GxN1tVqBhY6w\"}"
    }
  ],
  "expect": {
    "reason": null
  }
}
